Conceptual explanation,Direct interdependence of systemic problems,Direct interdependence mechanisms,Indirect interdependence of systemic problems
Systemic problems as contextual condition of other systemic problem,✓,Х,X
Different systemic problems cause the same activity,✓,Х,X
Different activities in one blocking mechanism are caused by different systemic problems,X,X,✓
Systemic problems as contextual conditions for activities in a blocking mechanism,X,X,✓
The same activities across different blocking mechanisms,X,✓,✓
Interaction of activities of different blocking mechanisms,X,✓,✓
