,Multimodal                          N                        = 17,Standard                          N                        = 18
"Age, years (mean (SD))",77 (7),78 (10)
"Gender, men (N (%))",9 (53%),12 (66%)
Disease duration (mean (SD)),17 (9),11 (4)
"LEDD, mg/day (mean (SD))",749 (381),869 (327)
"MMSE, score (mean (SD))",21 (3),18 (6)
"MoCA, score (mean (SD))",19 (5),18 (5)
"MDS-UPDRS 2, ADL score (mean (SD)) (ON)",22 (6),20 (7)
"MDS-UPDRS 3, motor score (mean (SD)) (ON)",38 (8),35 (9)
