"Site, location",Designation,Site description and communities/species/features of interest
"Brymbo Fossil Forest, Wrexham",SSSI             2,Internationally important plant fossil assemblage in 14 m bed of exposed Upper Carboniferous Coal Measures. In situ fossil lycophytes and large stands of fossilised             Calimites            (      )
"Carnforth Slag Bank, Lancashire","Local Nature Reserve (LNR)             1            , SAC             3            , Ramsar             4","Calcareous grassland on slag heaps which form a protective barrier to partially reclaimed landward saltmarsh. Lapwing (             Vanellus vanellus            ), ringed plover (             Charadrius hiaticula            ), oystercatcher (             Haematopus ostralegus            ), marsh harrier (             Circus aeruginosus            )."
"Coatham Marsh, North Yorkshire","LNR             1            , National Nature Reserve             2            , SPA             3            , Ramsar             4            .","Reedbeds, open water and grassland on complex of slag heaps and medieval salt diggings. Northern marsh orchid (             Dactylorhiza purpurella            ), bee orchid (             Ophyrs apifera            ). Redshank (             Tringa tetanus            ), reed warbler (             Acrocephalus scirpaceus            ), reed bunting (             Emberiza schoeniclus            ), water rail (             Rallus aquaticus            )."
"Kirkless Nature Reserve, Wigan, Lancashire",LNR             1,Locally important calcareous grassland similar to coastal dune communities on former iron and steel slag (      ). Common broomrape (             Orobanche minor            ); southern marsh orchid (             Dactylorhiza praetemissa            ).
"Maryport Harbour, Cumbria",SSSI             2,"Ruderal plant communities on coal washings, spoil, and iron slag. Northerly most site in UK for purple or yarrow broomrape (             Orobanche purpurea            ); pyramidal orchid (             Anacamptis pyramidalis            )."
"Millom Ironworks, Borwick Rails and Askham Slag Banks, Cumbria","LNR             1            , SSSI             2            , SPA             3            , SAC             3            , Ramsar             4            .",Extensive slag banks on estuarine margin with calcareous grassland and ponds. Natterjack toad (             Epidalea calamita            ). Orchid-rich grassland with northern marsh orchid (             Dactylorhiza purpurella            ) and bee orchid (             Ophyrs apifera            ). Skylark (             Alauda arvensis            ).
"Sawcliffe Hill / Crosby Warren, Lincolnshire",LNR             1,Community woodland and calcareous grassland on steel slag. Common lizard (             Zootoca vivipara            ). Grayling (             Hipparchia semele            ).
"Shotton Lagoons and Reedbeds, Flintshire, Wales",SSSI             2,Reedbeds and lagoons formed in part by land reclamation for adjacent steel and industrial plants. Nationally scarce white mullein (             Verbascum lychnitis            ) grows on slag heaps; variegated horsetail (             Equisetum variegatum            ) present in swamp. Breeding population of common tern (             Sterna hirundo            ).
