Disease name,Causative gene,Mutation,Regions affected,Reports utilizing iPSCs
SCA2,ATXN2,CAG repeat,"Purkinje cell, red nucleus, inferior olivary nucleus, pontine nucleus, cerebral cortex, substantia nigra, pyramidal tract, lower motor neuron","Neuron            (             Chuang et al., 2019            ;             Xia et al., 2013            )"
SCA3,ATXN3,CAG repeat,"Cerebellar dentate nucleus, pontine nucleus, Clarke's column, substantia nigra, globus pallidus, subthalamic nucleus, pyramidal tract, lower motor neuron","TUJ1             +            neuron            (             Chuang et al., 2019            ;             Hansen et al., 2016            ;             Koch et al., 2011            ;             Ou et al., 2016            ;             Ouyang et al., 2018            )"
SCA6,CACNA1A,CAG repeat,"Purkinje cell, cerebellar granule cell","Purkinje cell, neuron            (             Bavassano et al., 2017            ;             Ishida et al., 2016            )"
SCA7,ATXN7,CAG repeat,"Cerebellum, brainstem, retina","TUJ1             +            neuron, neuronal progenitor            (             Luo et al., 2012            ;             Ward et al., 2019            )"
SCA36,NOP56,GGCCTG repeat,"Purkinje cell, hypoglossal nucleus, lower motor neuron","ISLET             +            /TUJ1             +            lower motor neuron            (             Matsuzono et al., 2017            )"
SCA42,CACNA1G,5144G>A; R1715H,Purkinje cell,"Purkinje cell            (             Morino et al., 2015            )"
FRDA,FXN,GAA repeat,"Dorsal column of spinal cord, spinocerebellar tract, Clarke's column, dorsal root ganglion","MAP2             +            , TUJ1             +            neuron, NEUN             +            neuronal progenitor            (             Bird et al., 2014            ;             Hick et al., 2013            ;             Ku et al., 2010            ;             Polak et al., 2016            ;             Soragni et al., 2015            ;             Soragni et al., 2014            )"
AT,ATM,–,"Purkinje cell, cerebellar granule cell","Cerebellar neuron            (             Nayler et al., 2017            )"
