Strategy,Sc1,Sc2,Sc3,Sc4,Sc5,tendency VR (explanation),tendency E                           NH3                          (explanation)
M1,+,–,–,o,o,lowest (estimates maximum                             C                              O                                2                                  i                                  n                                  s                                  i                                  d                                  e                                -                             C                              O                                2                                  o                                  u                                  t                                  s                                  i                                  d                                  e                                ),highest (uses maximum                             N                              H                                3                                  i                                  n                                  s                                  i                                  d                                  e                                )
M2,–,–,+,+,o,moderate,moderate
M3,–,+,o,o,o,highest                         !                        (artificial maximum of                             C                              O                                2                                  o                                  u                                  t                                  s                                  i                                  d                                  e                                ),moderate
M4,–,+,+,–,+,moderate,lowest (uses low NH3                           inside                          –NH3                           outside                          )
M5,–,+,+,–,+,moderate,lowest (uses low NH3                           inside                          –NH3                           outside                          )
