id	annotator	position	question	table_file	answer_coordinates	answer_text	aggregation	float_answer
1	0	0	At the same time, these networks often occur in tandem at the firm level.	train_man_1.csv	[]	1		
1	0	0	For each network interaction, there is considerable variation both across and within countries.	train_man_1.csv	[]	1		
1	0	0	The n value is same for Hong Kong and Malaysia.	train_man_1.csv	[]	0		
1	0	0	There are 9 different types country in the given table.	train_man_1.csv	[]	1		
2	0	0	All the Publication titles are unique.	train_man_2.csv	[]	1		
3	0	0	Polymer ( reg. ) have highest d [nm] of 123.	train_man_3.csv	[]	1		
3	0	0	Polymer 2T-HD and T-HD have same d [nm] value of 108.	train_man_3.csv	[]	1		
3	0	0	Polymer ( reg. ) have lowest d [nm] of 123.	train_man_3.csv	[]	0		
3	0	0	Polymer 2T-DT and TT-DT have four solutions	train_man_3.csv	[]	0		
3	0	0	Polymer 2T-DT and TT-DT have two solutions	train_man_3.csv	[]	1		
3	0	0	There are eight different Polymers.	train_man_3.csv	[]	1		
3	0	0	Using T-HD ( reg. ) and thus replacing the random for a regular polymer with a higher M n , recovers some of the loss in J sc and gives a similar EQE when processed from chloroform and toluene, resulting in PCEs of 6.6% and 6.1%, respectively ( Table 2 ).	train_man_3.csv	[]	1		
4	0	0	5.07 and 5.19 eV for the HOMO and between 3.05 and 3.20 eV for the LUMO.	train_man_4.csv	[]	1		
4	0	0	HOMO [eV] and LUMO [eV] contains all negative values.	train_man_4.csv	[]	1		
4	0	0	T-HD ( reg. ) has the least values when compared to T-HD ( ran. ).	train_man_4.csv	[]	0		
5	0	0	There are 16 tissues and organs observed.	train_man_5.csv	[]	1		
5	0	0	Also two categories,i.e Developing and Adult are observed for each mammal.	train_man_5.csv	[]	1		
5	0	0	Heart in both human and mouse have ISH, IF [ ] NB [ ].	train_man_5.csv	[]	1		
5	0	0	This wide expression pattern seems to be quite well conserved between mice and humans, even though comparisons cannot be made for all organs due to incomplete data.	train_man_5.csv	[]	1		
6	0	0	-0.083 Share of farms who made investments co-financed by the EU (total farms = 100) is Hellwig development index for Auinfrastructure and location rentAu.	train_man_6.csv	[]	1		
6	0	0	-0.021 Amount of investments co-financed by the EU (EUR per hectare of agricultural land in the commune) is Hellwig development index for Aueconomy and standards of livingAu Variable.	train_man_6.csv	[]	1		
6	0	0	Hellwig development index for Auinfrastructure and location rentAu -0.012 is Mean indicator of socioeconomic development Variable.	train_man_6.csv	[]	1		
6	0	0	Similarly, the values of characteristics in particular quintile groups ( Table 5 ), defined based on the share of investing farms, are at similar levels and usually do not follow any considerable upward or downward trends.	train_man_6.csv	[]	1		
7	0	0	65.7 Quality index of agricultural production space (score) for 6.02-10.26% Communes grouped by the share of farms who made investments co-financed under AuModernizationAAu and AuSetting upAAu programs.	train_man_7.csv	[]	1		
7	0	0	18.0 is the total for Quality index of agricultural production space (score)	train_man_7.csv	[]	0		
7	0	0	Communes grouped by the share of farms who made investments co-financed under AuModernizationAAu and AuSetting upAAu programs 16.68-57.52% is 70.2	train_man_7.csv	[]	1		
7	0	0	The smallest numbers of farms with an area of over 10 ha are located in southeast Poland.	train_man_7.csv	[]	1		
7	0	0	45.8 is Total of Share of farms with an area of over 10 ha (total farms in the commune = 100)	train_man_7.csv	[]	1		
7	0	0	60.5 Quality index of agricultural production space (score) for 0-2.25% Communes grouped by the share of farms who made investments co-financed under AuModernizationAAu and AuSetting upAAu programs .	train_man_7.csv	[]	1		
7	0	0	65.8 is the total for Quality index of agricultural production space (score)	train_man_7.csv	[]	1		
7	0	0	Communes grouped by the share of farms who made investments co-financed under AuModernizationAAu and AuSetting upAAu programs 16.68-57.52% is 45.8	train_man_7.csv	[]	0		
7	0	0	Similarly, in subsequent quintile groups ( Table 7 ), the different characteristics of the agrarian structure grow consistently from 18 % in the class 0Ai0.25 % to over 70 % in the class >16.68 %.	train_man_7.csv	[]	1		
8	0	0	Similarly, the values of characteristics in particular quintile groups ( Table 5 ), defined based on the share of investing farms, are at similar levels and usually do not follow any considerable upward or downward trends.	train_man_8.csv	[]	1		
8	0	0	The total value of Mean indicator of socioeconomic development is 7.17.	train_man_8.csv	[]	0		
8	0	0	The total value of Hellwig development index for Aueconomy and standards of livingAu is 0.77.	train_man_8.csv	[]	0		
8	0	0	The total value of Hellwig development index for Auinfrastructure and location rentAu is 0.21.	train_man_8.csv	[]	1		
8	0	0	The total value of Hellwig development index for Ausocial capitalAu is 0.77.	train_man_8.csv	[]	0		
8	0	0	There are five different categories.	train_man_8.csv	[]	1		
9	0	0	As a direct consequence of its nature, the Setting up... program attracted much less interest than the Modernization....	train_man_9.csv	[]	1		
9	0	0	Modernisation and Setting up are totally same from each other.	train_man_9.csv	[]	0		
9	0	0	Modernisation has a lowest number of farms.	train_man_9.csv	[]	0		
9	0	0	Nearly 100,000 investments co-financed under the Modernization....	train_man_9.csv	[]	1		
9	0	0	program and almost 38,000 investments co-financed under the Setting up....	train_man_9.csv	[]	1		
9	0	0	program were implemented on a countrywide basis over the lifespan of the 20072013 Rural Development Program ( Table 2 ).	train_man_9.csv	[]	1		
9	0	0	Setting up has a highest number of farms.	train_man_9.csv	[]	0		
9	0	0	There are 2 different types of measures.	train_man_9.csv	[]	1		
9	0	0	There are 3 different types of measure.	train_man_9.csv	[]	0		
10	0	0	Table 3 presents the results for communes grouped into quintile classes illustrated in Fig.	train_man_10.csv	[]	1		
10	0	0	The total of Share of farms who made investments co-financed by the EU is 10.1.	train_man_10.csv	[]	1		
10	0	0	The total of Share of farms who made investments co-financed by the EU is 2173.	train_man_10.csv	[]	0		
11	0	0	Quality index of agricultural production space will have 0.098 EUR per farm.	train_man_11.csv	[]	0		
11	0	0	There are 2 Amount of investments co-financed by the EU i.e, EUR per hectare of agricultural land and farm.	train_man_11.csv	[]	1		
12	0	0	Format JSON and CSV has same Import utility that is mongoimport.	train_man_12.csv	[]	1		
12	0	0	Data have been published in three formats to provide maximum flexibility, and they have been summarized in Table 1 .	train_man_12.csv	[]	1		
12	0	0	Format BSON has Import utility that is mongorestore.	train_man_12.csv	[]	1		
12	0	0	There are six different formats.	train_man_12.csv	[]	0		
12	0	0	There are three different formats.	train_man_12.csv	[]	1		
12	0	0	There are three different type of Import utility.	train_man_12.csv	[]	0		
13	0	0	The Phase2.ipynb has a main goal of Data augmentation with calculated features and anonymization of personal properties.	train_man_13.csv	[]	1		
13	0	0	The Phase3.ipynb has a main goal of Statistical analysis of the data regarding the social bots activities.	train_man_13.csv	[]	1		
13	0	0	The Phase4.ipynb has a main goal of Feature engineering, analysis, and representation of users political classification.	train_man_13.csv	[]	1		
13	0	0	There are 2 different types of case in the given table.	train_man_13.csv	[]	0		
13	0	0	There are 5 different types phase in the given table.	train_man_13.csv	[]	1		
13	0	0	These notebooks are provided with a document ( datacollection.md ) that describes the supplementary materials that are necessary to understand the methodology and implementation of the experiments.	train_man_13.csv	[]	1		
14	0	0	Most of the features considered for the gathered users are extracted from Botometer.	train_man_14.csv	[]	1		
14	0	0	The complete list of features included for each user is indicated in Table 4 .	train_man_14.csv	[]	1		
14	0	0	The Description for scores.categories.temporal (feature)is Overall classification results  .	train_man_14.csv	[]	0		
14	0	0	The table has five heads -Feature ,Description ,Origin ,Anon and Domain.	train_man_14.csv	[]	1		
14	0	0	The table has nine heads.	train_man_14.csv	[]	0		
14	0	0	There are two Domain- UUID and R  [0,5].	train_man_14.csv	[]	0		
14	0	0	There is only one Origin -Twitter.	train_man_14.csv	[]	0		
15	0	0	Origin is classified into 4 types.	train_man_15.csv	[]	0		
15	0	0	The description for user_id is Type of tweet: original, retweet, reply, or quote .	train_man_15.csv	[]	0		
15	0	0	There are 21 types of feature in the given table.	train_man_15.csv	[]	1		
15	0	0	There are 25 types of feature in the given table.	train_man_15.csv	[]	0		
16	0	0	For Non-responders n = 13 has unique P value for SAP Parameter compare to other Parameter.	train_man_16.csv	[]	0		
16	0	0	For Responders n = 22 Baseline has highest value for TPG, mmHg Parameter.	train_man_16.csv	[]	0		
16	0	0	In the non-responder group, less prominent but significant reduction of PASP, mPAP and PVR were noted.	train_man_16.csv	[]	1		
16	0	0	The table contain 12 types of parameter.	train_man_16.csv	[]	1		
17	0	0	Each Classification has a different figure.	train_man_17.csv	[]	1		
17	0	0	The definition of No consolidation is the fracture gap is visible in all three planes; fracture margins have sharp limitations.	train_man_17.csv	[]	1		
17	0	0	Regarding fracture healing, at 3 weeks post-surgery 25% of all cases showed no consolidation, 50% an incipient and 25%	train_man_17.csv	[]	1		
17	0	0	The definition of No consolidation is the fracture gap shows No consolidation including bone bridges in all three planes; fracture margins have indistinct limitations.	train_man_17.csv	[]	0		
17	0	0	There are five classifications of grading of fracture consolidation.	train_man_17.csv	[]	0		
17	0	0	The definition of Consolidation is the fracture gap is visible in all three planes; fracture margins have sharp limitations.	train_man_17.csv	[]	0		
17	0	0	The definition of Consolidation is the fracture gap shows bone consolidation in all three planes; fracture margins are not determinable.	train_man_17.csv	[]	1		
17	0	0	The definition of Incipient Consolidation is the fracture gap shows bone consolidation in all three planes; fracture margins are not determinable.	train_man_17.csv	[]	0		
17	0	0	The definition of Incipient consolidation is the fracture gap shows incipient consolidation including bone bridges in all three planes; fracture margins have indistinct limitations.	train_man_17.csv	[]	1		
18	0	0	Concentration ranges from 136.1 to 5844.	train_man_18.csv	[]	1		
18	0	0	Reagent KH 2 PO 4 salt has Lowest Concentration.	train_man_18.csv	[]	1		
18	0	0	Reagent NaCl salt has highest Concentration .	train_man_18.csv	[]	1		
18	0	0	Reagent NaCl salt has Lowest Concentration .	train_man_18.csv	[]	0		
19	0	0	Al, Si, Fe, Ni, Pb are five trace elements given in the table.	train_man_19.csv	[]	1		
19	0	0	Element Fe has highest concentration.	train_man_19.csv	[]	0		
19	0	0	Element Pb has highest concentration.	train_man_19.csv	[]	1		
20	0	0	At each N, there are 5 values at varying levels of x	train_man_20.csv	[]	1		
20	0	0	All rows are completely filled with values.	train_man_20.csv	[]	1		
20	0	0	Here x=0.5 has low value of N = 10 that is 1.26 o 10 - 3.	train_man_20.csv	[]	0		
20	0	0	The value of x starts from 0.1 to 0.9 only odd numbers.	train_man_20.csv	[]	1		
20	0	0	There are 6 different categories in the table.	train_man_20.csv	[]	1		
20	0	0	There are empty data in the table.	train_man_20.csv	[]	0		
21	0	0	Every N value has the same Cond ( A ).	train_man_21.csv	[]	0		
21	0	0	N at 10 and 20 value have the same RMS value.	train_man_21.csv	[]	0		
21	0	0	N at 20 and 30 have 0.4 h in value.	train_man_21.csv	[]	1		
21	0	0	Every N value has different RMS values.	train_man_21.csv	[]	1		
21	0	0	N at 30 has 50.46 as Cond ( A ).	train_man_21.csv	[]	0		
21	0	0	N at 50 has the highest Cond ( A ) value.	train_man_21.csv	[]	1		
21	0	0	N at 50 has the highest h value.	train_man_21.csv	[]	0		
21	0	0	N at 50 has the lowest Cond ( A ) value.	train_man_21.csv	[]	0		
22	0	0	In 0.1 the highest error is 3.91  10 - 3 under N=10.	train_man_22.csv	[]	1		
22	0	0	In 0.7 the Highest error is 1.51  10 - 7 under N=30.	train_man_22.csv	[]	0		
22	0	0	In 0.7 the Highest error is 4.64  10 - 8 under N=30.	train_man_22.csv	[]	1		
22	0	0	In 0.9 the lowest error is 1.51  10 - 7 under N=30.	train_man_22.csv	[]	1		
22	0	0	In table under x they have ten different errors.	train_man_22.csv	[]	0		
23	0	0	Compare to all the least value of h =  2 N is 0.314159.	train_man_23.csv	[]	1		
23	0	0	E abs has only five data values under it.	train_man_23.csv	[]	1		
23	0	0	E abs has only one data values under it.	train_man_23.csv	[]	0		
23	0	0	The column of N ranges from 10 to 50.	train_man_23.csv	[]	1		
23	0	0	The column of N ranges from 50 to 100.	train_man_23.csv	[]	0		
23	0	0	The graph of the approximate and exact solutions is in Fig. 1 which are coincide together.	train_man_23.csv	[]	1		
23	0	0	The highest value under h =  2 N is 9.7081.	train_man_23.csv	[]	0		
24	0	0	In 0.3 the Lowest error is 1.05x10-6 under N=30.	train_man_24.csv	[]	1		
24	0	0	In 0.3 the Lowest error is 7.22  10 - 6 under N=30.	train_man_24.csv	[]	0		
24	0	0	In 0.7 the Highest error is 9.05  10 - 6 under N= 20.	train_man_24.csv	[]	1		
24	0	0	The loglog plot of the approximate and exact solutions is in the Fig. 3 .	train_man_24.csv	[]	1		
25	0	0	Table 4 is consist of list of the errors (26)(28) , and Cond ( A ) .	train_man_25.csv	[]	1		
25	0	0	The Table contain 4 categories.	train_man_25.csv	[]	0		
25	0	0	The value of h ranges from 0.314159 to 0.702481.	train_man_25.csv	[]	1		
25	0	0	The value of h ranges from 0.415459 to 0.900481.	train_man_25.csv	[]	0		
25	0	0	The value of N ranges from 10 to 50.	train_man_25.csv	[]	1		
26	0	0	Epitope location is having unique values.	train_man_26.csv	[]	1		
26	0	0	Reduced brain Ab burden is having + and - in the studies.	train_man_26.csv	[]	0		
26	0	0	Slowing of cognitive decline is also having + and - in the studies.	train_man_26.csv	[]	0		
26	0	0	There are 13 unique antibody .	train_man_26.csv	[]	1		
26	0	0	There are unique Company's observed.	train_man_26.csv	[]	0		
27	0	0	The clinical outcomes are observed to be unique according to patients.	train_man_27.csv	[]	0		
27	0	0	These results established a positive safety profile for inclusion of BIIB076 into phase I trials.	train_man_27.csv	[]	1		
27	0	0	This trial ( NCT03056729 ) recruited healthy and mild-AD volunteers to monitor adverse events and pharmacokinetics ( Table 2 ).	train_man_27.csv	[]	1		
28	0	0	Health and Social (Q)Non-home-based business is 0.22.	train_man_28.csv	[]	0		
28	0	0	Non-home-based business 0.29 for Village/rural Variables.	train_man_28.csv	[]	0		
28	0	0	This said, descriptive findings show that the geography of sales is more international and national in nature amongst home-based businesses compared to non-home-based businesses ( Table 1 ).	train_man_28.csv	[]	1		
28	0	0	Variables International Home-based business 0.12.	train_man_28.csv	[]	1		
28	0	0	Variables International Home-based business 0.66 .	train_man_28.csv	[]	0		
28	0	0	Variables More than half Home-based busines is 0.10.	train_man_28.csv	[]	1		
29	0	0	Home-based business (yes/no) are 1st research question.	train_man_29.csv	[]	1		
29	0	0	Interaction term between home-based business and business location is the 2nd research question.	train_man_29.csv	[]	1		
29	0	0	Lives with children is the 2nd research question.	train_man_29.csv	[]	0		
29	0	0	Part-time business is the 1st research question.	train_man_29.csv	[]	0		
29	0	0	There are 25 Modelling framework observed in the tables .	train_man_29.csv	[]	0		
30	0	0	0.60% Top Three Words are Risk Vulner Resili.	train_man_30.csv	[]	1		
30	0	0	3.60% Theme of Agronomy has Topic Label Crop Diseases.	train_man_30.csv	[]	1		
30	0	0	Risk Vulner Resili Theme of Agronomy has Topic Label Crop Diseases.	train_man_30.csv	[]	0		
30	0	0	Topic Label Bio Energy Top Three Words are Bioenergi Energi Gas.	train_man_30.csv	[]	1		
31	0	0	Field Crops Research has less Number of Articles of 95.	train_man_31.csv	[]	1		
31	0	0	Food Policy has high Number of Articles of 309.	train_man_31.csv	[]	1		
31	0	0	There are ten top journals for publications related to food security.	train_man_31.csv	[]	0		
32	0	0	Health has equal percentage in HICs and Africa region.	train_man_32.csv	[]	0		
32	0	0	Health has equal percentage in HICs and Asia region.	train_man_32.csv	[]	1		
33	0	0	The highest time required to isolated yields is 2(h).	train_man_33.csv	[]	0		
33	0	0	The highest yield percentage is 91.	train_man_33.csv	[]	1		
33	0	0	The lowest yield percentage is 0.	train_man_33.csv	[]	1		
33	0	0	The lowest yield percentage is 20.	train_man_33.csv	[]	0		
33	0	0	The optimal reactions conditions varies .	train_man_33.csv	[]	1		
34	0	0	All the samples synthesized under optimal conditions are listed in Table 2 .	train_man_34.csv	[]	1		
34	0	0	The given table has Entry from 1 to 30.	train_man_34.csv	[]	1		
34	0	0	Yield 57 and 90 works for (CH 3 ) 2 CHCH 2 and CH 3 CH 2 CH 2 reactions.	train_man_34.csv	[]	0		
35	0	0	The df value is same for all the sources except Block source.	train_man_35.csv	[]	1		
35	0	0	The lowest H . perforatum value is 0.09 of Insecticide application [I] source.	train_man_35.csv	[]	1		
35	0	0	The Relative frequency [RF] of H . perforatum has the highest value of 58.67*** among all other species.	train_man_35.csv	[]	1		
35	0	0	The df value is same for all the sources except F x I source.	train_man_35.csv	[]	0		
35	0	0	We found significantly lower per capita rates of increase in P .peregrina when fungicide was applied.	train_man_35.csv	[]	1		
36	0	0	Compare to all D. giganteus has 44.56 highest value.	train_man_36.csv	[]	0		
36	0	0	RF x F x I has 6.40 * as P . peregrina value.	train_man_36.csv	[]	1		
36	0	0	RF x F x I has 9.40 * as P . peregrina value.	train_man_36.csv	[]	0		
36	0	0	The value of d.f. is 8 for Block.	train_man_36.csv	[]	0		
36	0	0	There are eight source.	train_man_36.csv	[]	1		
37	0	0	Atlantic salmon scientific name is Salmo salar.	train_man_37.csv	[]	1		
37	0	0	Channel catfish scientific name is Ictalurus punctatus.	train_man_37.csv	[]	1		
37	0	0	The grass carp, common carp, and Nile tilapia are among the most important fish species in world aquaculture.	train_man_37.csv	[]	1		
37	0	0	They have 10 different Specific name .	train_man_37.csv	[]	0		
37	0	0	They have 14 different Common name.	train_man_37.csv	[]	1		
37	0	0	They have 14 different Order.	train_man_37.csv	[]	1		
38	0	0	Coverage will ranges from 60X to 899X.	train_man_38.csv	[]	0		
38	0	0	The aquaculture and fisheries genomics have made significant progress during the past decade since the first key fisheries species, Atlantic cod, was sequenced in 2011 ( Star et al., 2011 ).	train_man_38.csv	[]	1		
38	0	0	The majority of published genomes were sequenced using second-generation sequencing technologies, which produce short reads that are challenging in assembly.	train_man_38.csv	[]	1		
38	0	0	There are 5 Sequencing platforms.	train_man_38.csv	[]	0		
38	0	0	Tongue sole will have highest Chromosome number.	train_man_38.csv	[]	0		
39	0	0	Rainbow trout specie is having Sexual determination Function.	train_man_39.csv	[]	1		
40	0	0	The Interpretation for is  14 =  / K  is Impact on fishery price from aquaculture volume.	train_man_40.csv	[]	0		
40	0	0	The Parameter definition for Relative unit value of effort in fishery is  1 =  f q K G f / .	train_man_40.csv	[]	1		
40	0	0	The table has been divided into two heads - Parameter definition and Interpretation.	train_man_40.csv	[]	1		
40	0	0	There are fourteen Parameter definition.	train_man_40.csv	[]	1		
41	0	0	For the remaining parameters listed in Table 1 , it seems not possible to find estimates based on observations or experiments.	train_man_41.csv	[]	1		
41	0	0	The unit of w f is C E  1 T  1.	train_man_41.csv	[]	1		
41	0	0	The value of  f /  is 0.000025.	train_man_41.csv	[]	1		
41	0	0	The value of K is the highest 40000000 compare to all other values.	train_man_41.csv	[]	1		
41	0	0	There are five parameters.	train_man_41.csv	[]	1		
41	0	0	These parameters are listed in Table 3 .	train_man_41.csv	[]	1		
42	0	0	0.66 BaseHeightSTD for Model 4.	train_man_42.csv	[]	1		
42	0	0	0.69 BaseHeightSTD for Model 6.	train_man_42.csv	[]	0		
42	0	0	Average Adj. R 2 Model 2 is 0.64 for NoSTD.	train_man_42.csv	[]	1		
42	0	0	From Table 1 , it is clear that the model with the most explanatory power is Model 6, which yields the highest average adjusted R 2 across all flood protection standard assumptions.	train_man_42.csv	[]	1		
42	0	0	NoSTD 0.66 for Model 3.	train_man_42.csv	[]	1		
43	0	0	KPS (median; IQR) has a highest median in the total.	train_man_43.csv	[]	1		
43	0	0	Primary tumour type (%) Vulva and Fallopian tube has a lowest value in the total .	train_man_43.csv	[]	1		
43	0	0	The total n value for baseline characteristics is 78.	train_man_43.csv	[]	0		
43	0	0	There are 6 different types baseline characteristics in the given table.	train_man_43.csv	[]	0		
44	0	0	1 BM resected; no treatment for other BMs n is 2(2.7).	train_man_44.csv	[]	0		
44	0	0	1 BM resected; RT for other BMs n is 9(12.3).	train_man_44.csv	[]	0		
44	0	0	2 BMs resected; no treatment for other BMs n is 15(20.50.	train_man_44.csv	[]	0		
44	0	0	RT + Surgery n is 57 (78.1).	train_man_44.csv	[]	1		
44	0	0	RT n is 7 (9.6).	train_man_44.csv	[]	1		
44	0	0	Surgery n is 9 (12.3).	train_man_44.csv	[]	1		
44	0	0	The entire cohort had a median survival of 14.4 months, with a one-year survival of 56.4% and a two-year survival of 39.1%.	train_man_44.csv	[]	1		
45	0	0	The highest HR value is 8.70 in Vulva primary tumour type.	train_man_45.csv	[]	1		
45	0	0	The p value for CA-125 is <0.01.	train_man_45.csv	[]	1		
45	0	0	The Primary tumour type Ovary doesn't contain any value for HR and p.	train_man_45.csv	[]	1		
45	0	0	The Primary tumour type Ovary has negative value for HR.	train_man_45.csv	[]	0		
45	0	0	The table is defined into 3 columns - Variable, HR (95% CI) and p.	train_man_45.csv	[]	1		
45	0	0	The table is defined into 4 columns	train_man_45.csv	[]	0		
46	0	0	Description Irrigation canal below the primary canal Code Seccanal_name.	train_man_46.csv	[]	1		
46	0	0	polygon Geometry point Name is Irrigated Farmland.	train_man_46.csv	[]	1		
46	0	0	line Geometry point Name is Irrigated Farmland.	train_man_46.csv	[]	0		
47	0	0	The irrigation structure in each village are grouped into one shapefile.	train_man_47.csv	[]	1		
47	0	0	The point worksheet contains information on the shapefiles of irrigation structures.	train_man_47.csv	[]	1		
47	0	0	All the Description are observed unique.	train_man_47.csv	[]	0		
47	0	0	Here water is the main resources of irrigation.	train_man_47.csv	[]	1		
47	0	0	The irrigation structure in each village are grouped into one shapefile .	train_man_47.csv	[]	1		
48	0	0	The purpose of this enumeration is to define the location of each WUA and its corresponding operation area.	train_man_48.csv	[]	1		
48	0	0	There are 12 column to find the details.	train_man_48.csv	[]	1		
48	0	0	We also collected information on the essential characteristics of WUA, such as presented in Table 1 .	train_man_48.csv	[]	1		
49	0	0	Table 2 provides variable descriptions in the geolocation_data worksheet.	train_man_49.csv	[]	1		
49	0	0	The code for WUA and Village is not given.	train_man_49.csv	[]	1		
49	0	0	The source is differentiated into official data and enumeration.	train_man_49.csv	[]	1		
49	0	0	There are 8 different types of description.	train_man_49.csv	[]	1		
49	0	0	WUA and Village has a enumeration source.	train_man_49.csv	[]	1		
49	0	0	WUA and Village has a official source.	train_man_49.csv	[]	0		
50	0	0	The Chemical composition of Ni is 17.77.	train_man_50.csv	[]	0		
50	0	0	There are Eight different Chemical composition.	train_man_50.csv	[]	1		
50	0	0	The Chemical composition of Ni is 19.07.	train_man_50.csv	[]	1		
50	0	0	The Chemical composition of P is 0.177.	train_man_50.csv	[]	0		
50	0	0	The Chemical composition of Si is 0.30.	train_man_50.csv	[]	1		
50	0	0	The material was received as a round-bar of 20 mm in diameter, fabricated by hot-rolling and subsequently solution-annealed at 1,080AoC, followed by water-quenching.	train_man_50.csv	[]	1		
50	0	0	There are ten different Chemical composition.	train_man_50.csv	[]	0		
51	0	0	6 was attempted based on the strain-to-failure values (not uniform elongation) in order to compare them with those in the samples subjected to stress-relaxation and strain-aging experiments where an incidence of yield-drop, to be described later, made it difficult to accurately determine the maximum nominal stress ( i.e. ultimate tensile strengths) that indicate the end of uniform elongation.	train_man_51.csv	[]	1		
51	0	0	Nonetheless, the constancy of local elongation, as recorded in Table 2 , suggests that the trend towards uniform elongation is also directly reflected by the differences in total elongation-to-fracture.	train_man_51.csv	[]	1		
51	0	0	Reduction in area (  ) ranges from 60 to 96.3.	train_man_51.csv	[]	0		
51	0	0	Reduction in area (  ) ranges from 79.8 to 86.3.	train_man_51.csv	[]	1		
51	0	0	The table CH has 2 categories such as mass and at.	train_man_51.csv	[]	1		
51	0	0	The table CH has 5 categories .	train_man_51.csv	[]	0		
51	0	0	The table contain same values for all the parameters.	train_man_51.csv	[]	0		
