id	annotator	position	question	table_file	answer_coordinates	answer_text	aggregation	float_answer
217	0	0	Data for allele frequencies at five microsatellite loci are presented in Table 3 .	train_man_217.csv	[]	1		
217	0	0	The highest Unidentified value for male is 0.50.	train_man_217.csv	[]	1		
218	0	0	The children prefers to eat some tasty food .	train_man_218.csv	[]	0		
218	0	0	There are four types of Shifting food patterns at home is described.	train_man_218.csv	[]	1		
219	0	0	I worked for a supermarket, so I know that the supermarket is secure.	train_man_219.csv	[]	0		
219	0	0	If you cook one time for several meals, you are more likely to get cancer.	train_man_219.csv	[]	1		
219	0	0	Recently it was in the news that supermarkets erased all the dates on expired products and relabelled them.	train_man_219.csv	[]	1		
219	0	0	There is no Lack of trust in the safety of supermarket foods.	train_man_219.csv	[]	0		
220	0	0	Mother in law saying that markets are very expensive.	train_man_220.csv	[]	0		
220	0	0	Mother in law was saying that supermarkets is best for shopping.	train_man_220.csv	[]	0		
220	0	0	There are 2 different role in the given table.	train_man_220.csv	[]	1		
221	0	0	How supermarkets are utilized has been divided into five categories .	train_man_221.csv	[]	0		
221	0	0	How supermarkets are utilized has been divided into two categories - Items purchased and Other utility	train_man_221.csv	[]	1		
221	0	0	There are few Customers who sometimes bring their children to the supermarket and they can choose what they want.	train_man_221.csv	[]	1		
222	0	0	Here the agent wants to close the street market .	train_man_222.csv	[]	1		
223	0	0	All FCR-D values are lesser than FCR-N values.	train_man_223.csv	[]	0		
223	0	0	All the absolute values of Ideal Estimate is more than the absolute values of Proposed Method.	train_man_223.csv	[]	1		
223	0	0	In addition, Table 1 shows the average profit for each charging event and per kWh of energy used for EV charging.	train_man_223.csv	[]	1		
223	0	0	The lowest FCR-N value is 0.009 of Per kWh in Ideal Estimate.	train_man_223.csv	[]	1		
223	0	0	There are 2 scenarios in the given table.	train_man_223.csv	[]	1		
224	0	0	MPO only has a polyclonal clone.	train_man_224.csv	[]	1		
224	0	0	There are ten types of antibodies.	train_man_224.csv	[]	1		
224	0	0	Except CD25 and CD163 other antibodies has Ventana platform.	train_man_224.csv	[]	1		
225	0	0	Extensive is having high Cortisol that is 1300nmol/l.	train_man_225.csv	[]	1		
225	0	0	Residual Tumor is having completely yes in Hypophysitis column.	train_man_225.csv	[]	1		
225	0	0	There are some blocks with not available details.	train_man_225.csv	[]	0		
226	0	0	Organ Pit. gl. only has 1+ positivity in 4%.	train_man_226.csv	[]	1		
226	0	0	Organ Pit. gl. only has 4+ positivity in 4%.	train_man_226.csv	[]	0		
227	0	0	Each value has a unique in the given table.	train_man_227.csv	[]	1		
227	0	0	The Fe has a no balance.	train_man_227.csv	[]	1		
227	0	0	The highest value is 150 in the given table.	train_man_227.csv	[]	0		
227	0	0	The lowest value is <0.002.	train_man_227.csv	[]	1		
227	0	0	The material used in this study was F82H-IEA.	train_man_227.csv	[]	1		
228	0	0	Insulation technology are of four types.	train_man_228.csv	[]	1		
228	0	0	Rate of Return (%) ranges from 6 to 11.	train_man_228.csv	[]	1		
228	0	0	Rate of Return of different insulation technologies are observed.	train_man_228.csv	[]	1		
228	0	0	Roof insulation is having 8% second highest of rate of return.	train_man_228.csv	[]	1		
229	0	0	Each energy technology has different block type.	train_man_229.csv	[]	1		
229	0	0	Sensor is present only in Roof isolation.	train_man_229.csv	[]	0		
229	0	0	Sensor is present only in Solar panels.	train_man_229.csv	[]	1		
229	0	0	There are five renewable energy technologies are given.	train_man_229.csv	[]	1		
229	0	0	There are six renewable energy technologies are given.	train_man_229.csv	[]	0		
229	0	0	Yellow wool and orange wool are two different block types.	train_man_229.csv	[]	1		
230	0	0	The combination of Floor, roof, wall has less number of houses.	train_man_230.csv	[]	1		
230	0	0	The combination of Floor, roof, wall, window has less number of houses.	train_man_230.csv	[]	0		
230	0	0	The combination of Floor, roof, wall, window has more number of houses.	train_man_230.csv	[]	1		
230	0	0	The number of other combination houses are 102.	train_man_230.csv	[]	0		
230	0	0	The number of other combination houses are 572.	train_man_230.csv	[]	1		
230	0	0	The only one combination has window combined with.	train_man_230.csv	[]	1		
230	0	0	There are five types of insulation combinations.	train_man_230.csv	[]	0		
230	0	0	There are four types of insulation combinations.	train_man_230.csv	[]	1		
231	0	0	'Average number of solar panels per building' has lowest mean value.	train_man_231.csv	[]	1		
231	0	0	'Number of solar panels' has highest Min. value.	train_man_231.csv	[]	1		
232	0	0	All insulation has a highest value in Payback period (years).	train_man_232.csv	[]	1		
232	0	0	All insulation has a value in electricity production.	train_man_232.csv	[]	0		
232	0	0	All insulation has no value in electricity production.	train_man_232.csv	[]	1		
232	0	0	All technologies has a highest value in investment cost.	train_man_232.csv	[]	1		
232	0	0	Solar panels has a no value in electricity production.	train_man_232.csv	[]	0		
233	0	0	log(board size) log(Compensation) under AS-IV is 0.042.	train_man_233.csv	[]	1		
233	0	0	ROA (ind-adj) 1 (Chair duality) under OLS is (26.38).	train_man_233.csv	[]	0		
233	0	0	Stock return (ind-adj) 1 (Chair duality) under OLS is (5.73).	train_man_233.csv	[]	0		
233	0	0	The sample consists of 3323 firm-years from the combined database of corporate officers and directors merged with CEO compensation data drawn from Frydman and Saks (2010) from 1936 to 1991 and ExecuComp from 1992 to 2011.	train_man_233.csv	[]	1		
234	0	0	Firm  period fixed effects is N for all the categories.	train_man_234.csv	[]	0		
234	0	0	log(assets) has no values in the table.	train_man_234.csv	[]	0		
234	0	0	R 2 of Log (Compensation) is 0.898.	train_man_234.csv	[]	1		
234	0	0	The CEO tenure of Independence ratio is 0.155.	train_man_234.csv	[]	1		
234	0	0	The coefficient on CEO tenure  Post 2002 is 0.008 and insignificant, suggesting the tenure-compensation relation did not change post-2002.	train_man_234.csv	[]	1		
234	0	0	The ROA (ind-adj) of Log (Compensation) is 1.216.	train_man_234.csv	[]	1		
235	0	0	d p (mm) 1.00 for GAC.	train_man_235.csv	[]	1		
235	0	0	Packing material PAC is 0.01 k 1 (10 -9 m 2 ).	train_man_235.csv	[]	1		
236	0	0	11.5 is Na 2 O (% wt ) for Before.	train_man_236.csv	[]	1		
236	0	0	Al 2 O 3 (% wt ) After is 18.7.	train_man_236.csv	[]	0		
236	0	0	Na 2 O/Al 2 O 3 (mol/mol) Before is 0.8.	train_man_236.csv	[]	0		
236	0	0	SiO 2 (% wt ) Before is 4.2.	train_man_236.csv	[]	0		
236	0	0	SiO 2 (% wt ) Before is 46.8.	train_man_236.csv	[]	1		
237	0	0	All CCs are above the significance threshold of 0.5, with the lowest of 0.68 on August 6.	train_man_237.csv	[]	1		
237	0	0	Correlation Coefficient has the total for all dates of 0.27.	train_man_237.csv	[]	0		
237	0	0	Correlation Coefficient has the total for all dates of 0.79.	train_man_237.csv	[]	1		
237	0	0	Correlation Coefficient on date July 31, 2018 has the lowest value of 0.72.	train_man_237.csv	[]	1		
237	0	0	Correlation Coefficient on date July 9, 2018 has the highest value of 0.93.	train_man_237.csv	[]	1		
237	0	0	Correlation Coefficient on date July 9, 2018 has the lowet value of 0.97.	train_man_237.csv	[]	0		
237	0	0	P-Value is different for All dates.	train_man_237.csv	[]	0		
237	0	0	P-Value is same for All dates of 0.0.	train_man_237.csv	[]	1		
237	0	0	There are eleven different Dates of Correlations between HMB and SJ profiles.	train_man_237.csv	[]	1		
237	0	0	This claim was also supported by a statistical analysis between HMB and SJ on each date.	train_man_237.csv	[]	1		
238	0	0	Stroke and Deep venous thrombosis,Neurological deterioration ,Liver failure is 0.0% for Cervical ( n = 33).	train_man_238.csv	[]	1		
238	0	0	Thoracic ( n = 48) has 4.2% for Delirium.	train_man_238.csv	[]	1		
238	0	0	Total ( n = 211) 30.3% is the lowest Sepsis.	train_man_238.csv	[]	0		
238	0	0	Deep venous thrombosis 0.9% is Thoracic ( n = 48).	train_man_238.csv	[]	0		
239	0	0	( n = 16/85) patients who received a transesophageal echocardiography (TEE) (18.8%), and in disseminated spondylodiscitis ( n = 7/13, 53.8%, Chi 2 F = 7.957, df3, p = 0.002).	train_man_239.csv	[]	1		
239	0	0	3MRGN does not have p-Value.	train_man_239.csv	[]	0		
239	0	0	Endocarditis has lowest p-Value.	train_man_239.csv	[]	1		
240	0	0	3.40 mean for Have had opportunities to affect plans for follow-up.	train_man_240.csv	[]	1		
241	0	0	Availability of staff counseling value of N is 169.	train_man_241.csv	[]	0		
241	0	0	Table 2 presents means and variance for each patient satisfaction item.	train_man_241.csv	[]	1		
241	0	0	The aspects of treatment receiving the highest ratings were staff perceptions, staff understanding the type of problem, and availability of staff counseling.	train_man_241.csv	[]	1		
241	0	0	The highest SD value is 4.54.	train_man_241.csv	[]	1		
241	0	0	The lowest Mean value is 3.78.	train_man_241.csv	[]	1		
241	0	0	The Lowest SD value is 4.54.	train_man_241.csv	[]	0		
241	0	0	They have 10 items measuring patient satisfaction .	train_man_241.csv	[]	1		
241	0	0	They have 5 items measuring patient satisfaction.	train_man_241.csv	[]	0		
242	0	0	Demographic Age 26Ai30 years old has lowest Percentage 0.94.	train_man_242.csv	[]	1		
243	0	0	Financial literacy and Investment behaviour has same CR value.	train_man_243.csv	[]	1		
243	0	0	Financial literacy has the least AVE value.	train_man_243.csv	[]	0		
243	0	0	Third, the accepted value of the convergent reliability should outweigh 0.50.	train_man_243.csv	[]	1		
244	0	0	0.163 Kurtosis Items is IB3.	train_man_244.csv	[]	0		
244	0	0	0.163 Kurtosis Items is IB9.	train_man_244.csv	[]	1		
244	0	0	Items FL1 Standard Deviation is 0.799.	train_man_244.csv	[]	1		
244	0	0	Items PI6 Mean is 3.150.	train_man_244.csv	[]	1		
244	0	0	Skewness 0.059 Items is SC9.	train_man_244.csv	[]	1		
244	0	0	Standard Deviation 0.991 Items is FL2.	train_man_244.csv	[]	0		
244	0	0	Standard Deviation 0.991 Items is FL6.	train_man_244.csv	[]	1		
245	0	0	CR 0.925 Variable is Self-control.	train_man_245.csv	[]	1		
245	0	0	Variable Financial literacy AVE is 0.913.	train_man_245.csv	[]	0		
245	0	0	Variable Financial literacy CR is 0.913.	train_man_245.csv	[]	1		
245	0	0	Variable Investment behaviour Cronbach's Alpha is 0.951.	train_man_245.csv	[]	0		
246	0	0	The accuracy of all knowledge statements of greater than 14.	train_man_246.csv	[]	1		
246	0	0	There are ten knowledge statements given with accuracy.	train_man_246.csv	[]	1		
246	0	0	To compute the variable knowledge, single scores per statement were aggregated over all ten questions, ranging from values of 0 to 10, where values represent the number of correct answers given.	train_man_246.csv	[]	1		
247	0	0	Cortical thickness (CTh) (mm) description is that Indicates the plate (surface) to rod (curve) ratio of the trabeculae. A higher ratio is a marker of greater trabecular network integrity ( ).	train_man_247.csv	[]	0		
247	0	0	Cortical thickness (CTh) (mm) description is that Represents mean cortical bone thickness.	train_man_247.csv	[]	1		
247	0	0	Elastic modulus (GPa) description is that Main component of FEA and a marker of bone mechanical competence.	train_man_247.csv	[]	1		
247	0	0	Erosion index (EI) description is that Represents the bone martr space between trabeculae.	train_man_247.csv	[]	0		
247	0	0	In table they have 8 kinds of MRI Parameter.	train_man_247.csv	[]	1		
247	0	0	Segmentation was determined by delineating the periosteal and endosteal boundaries of the bone with an operator-guided semi-automatic algorithm using custom-built software ( Rajapakse et al., 2012 ) and standard microarchitecture parameters were derived for trabecular and cortical bone.	train_man_247.csv	[]	1		
247	0	0	Table 1 outlines MRI parameters evaluated in this study.	train_man_247.csv	[]	1		
248	0	0	ALP value for both BV/TV (%) and TbTh (mm) is 0.5.	train_man_248.csv	[]	1		
248	0	0	ALP value for both BV/TV (%) and TbTh (mm) is 0.8.	train_man_248.csv	[]	0		
248	0	0	Both ALP and PTH contains negative values for EI and TbS (mm).	train_man_248.csv	[]	1		
248	0	0	The highest PTH value is -0.22 of CTh (mm).	train_man_248.csv	[]	0		
248	0	0	There are 9 types of different MRI parameter.	train_man_248.csv	[]	0		
249	0	0	Q,UM,I value varies for F1,F2 and F3.	train_man_249.csv	[]	1		
249	0	0	F1 has the lowest value of I.	train_man_249.csv	[]	1		
249	0	0	Three conditions, indicated as F1, F2 and F3 were tested.	train_man_249.csv	[]	1		
250	0	0	ADV_Raw; ADV_Post-processed is different for every Experiment set sub-folder.	train_man_250.csv	[]	0		
250	0	0	ADV_Raw; ADV_Post-processed is same for every Experiment set sub-folder.	train_man_250.csv	[]	1		
250	0	0	Data on vegetation characterization, flowrate and water depth are reported in this article.	train_man_250.csv	[]	1		
250	0	0	F_Data has three Test case sub-folder(F1,F2,F3).	train_man_250.csv	[]	1		
250	0	0	R_Data has five Test case sub-folder(R1,R2,R3).	train_man_250.csv	[]	0		
250	0	0	There are two different Experiment set sub-folder.	train_man_250.csv	[]	1		
251	0	0	The highest h (mm) value is 135 in R2.	train_man_251.csv	[]	1		
251	0	0	The Transect longitudinal location is measured in meters.	train_man_251.csv	[]	1		
251	0	0	There are 4 types of test run ranging from R1 to R4.	train_man_251.csv	[]	0		
252	0	0	GI value varies from 0.181 to 20.950.	train_man_252.csv	[]	1		
252	0	0	Property contains same phases.	train_man_252.csv	[]	0		
252	0	0	 23 mm -1 contains the highest mean value	train_man_252.csv	[]	1		
253	0	0	As can be seen in Table 5 , in a 6-year period, the highest number of citations were received by meteorologists and paleontologists (of course, taking the top 25 percent of individual publication performance into account).	train_man_253.csv	[]	1		
253	0	0	Geodesy and Geoinformatics has lowest counting method of 45.800.	train_man_253.csv	[]	1		
253	0	0	Paleontology have highest Recalibrated minimum values of 249 (248.572).	train_man_253.csv	[]	1		
253	0	0	There are ten different categories.	train_man_253.csv	[]	0		
254	0	0	Group 3 has highest number of scientific publications.	train_man_254.csv	[]	1		
255	0	0	As can be seen in Table 2 , the distribution of multi-authored publications among different disciplines shows an inhomogeneous pattern: in the case of the discipline of social geography, only two-thirds of the publications are multi-authored, and the average number of authors in multi-authored publications remains under four, whereas 95 percent of the publications in geophysics are created in co-production, and the average number of authors in those publications exceeds 9.5.	train_man_255.csv	[]	1		
255	0	0	Geophysics has the lowest Average number of co-authors per multi-authored publication.	train_man_255.csv	[]	0		
255	0	0	There are nine sections of earth sciences given.	train_man_255.csv	[]	1		
256	0	0	Geology RMVs in FC is 8 (6.539).	train_man_256.csv	[]	0		
256	0	0	In table they have 9 different topics on web of science.	train_man_256.csv	[]	1		
256	0	0	Meteorology Number of years required to fulfill minimum value in FC is 18.774.	train_man_256.csv	[]	1		
256	0	0	The lowest value in CMVs is 2.33 in Social Geography.	train_man_256.csv	[]	0		
257	0	0	As can be seen in Table 6 , the social geographers would experience the lowest RMV with a cumulative impact factor value of 0.343, whereas, it is the geologists who would be required to produce the highest cumulative impact factor value (2.608).	train_man_257.csv	[]	1		
257	0	0	Cumulative impact factor, 20142018, Number of years required to fulfill minimum criteria, and Recalibrated minimum values has 2 groups such as IC and FC.	train_man_257.csv	[]	1		
257	0	0	For example, in this respect, the cumulative impact factor value for geochemists will be only 7.4 times higher than for social geographers.	train_man_257.csv	[]	1		
257	0	0	Geophysics has unique Current minimum values.	train_man_257.csv	[]	0		
257	0	0	Paleontology has lowest FC value for Number of years required to fulfill minimum criteria.	train_man_257.csv	[]	0		
257	0	0	Social Geography has unique Current minimum values.	train_man_257.csv	[]	1		
258	0	0	12 () is the value given for Geography I (Social Geography)	train_man_258.csv	[]	0		
258	0	0	19 (+7) is the highest value Number of journal articles indexed in SCI/SSCI and Scopus scored under Geochemistry, Mineralogy, and Petrology.	train_man_258.csv	[]	1		
259	0	0	precision 1bpm variable is Heart Rate.	train_man_259.csv	[]	1		
259	0	0	variable Air temperature accuracy is 0.2 C.	train_man_259.csv	[]	1		
259	0	0	variable Air temperature accuracy is1 g.	train_man_259.csv	[]	0		
260	0	0	Standard errors are clustered at the district level.	train_man_260.csv	[]	0		
261	0	0	Age of given birth has highest mean (population) value.	train_man_261.csv	[]	1		
261	0	0	Female and male variables has same standard deviation.	train_man_261.csv	[]	1		
261	0	0	WASH variables and water does not have static deviation.	train_man_261.csv	[]	1		
261	0	0	Among the education numbers, higher education has the highest mean (population).	train_man_261.csv	[]	0		
262	0	0	Average rainfall anomalies ranges from 0.10*** to 0.11***.	train_man_262.csv	[]	1		
262	0	0	Sampling weights are applied.	train_man_262.csv	[]	0		
262	0	0	There are no values from some categories.	train_man_262.csv	[]	0		
262	0	0	We also find that children born to educated women tend to have higher HAZ scores and are less likely to be stunted and severely stunted compared to those whose mothers have no formal education.	train_man_262.csv	[]	1		
263	0	0	Pseudo R2 value is same in both Pre-monsoon season and Post-monsoon season.	train_man_263.csv	[]	1		
263	0	0	The results presented in Table 4 show that excessive rainfall increases the risk of stunting for children during the monsoon season or the months before, while children born later in the year are not affected.	train_man_263.csv	[]	1		
263	0	0	There are 4 seasons in period of birth.	train_man_263.csv	[]	0		
264	0	0	Effect change in % Components has a highest percentage (primary vs. no).	train_man_264.csv	[]	1		
264	0	0	Full model has a lowest value in (primary vs. no).	train_man_264.csv	[]	0		
264	0	0	Since mothers education is a categorical variable, Table 5 shows a coefficient for each level of education with no education being the reference category.	train_man_264.csv	[]	1		
264	0	0	The reduced model shows the total effect of mothers education on child stunting before the inclusion of potential mediators.	train_man_264.csv	[]	1		
265	0	0	The female is having highest % severely stunted than Male.	train_man_265.csv	[]	0		
266	0	0	Average rainfall anomalies 2 has lowest HAZ score.	train_man_266.csv	[]	1		
266	0	0	Average rainfall anomalies,Average rainfall anomalies 2 and Observations has unique values except (Pseudo) R 2.	train_man_266.csv	[]	0		
266	0	0	In a second robustness check, we account for potential migration, which would lead to mismatching of the rainfall data with childrens location.	train_man_266.csv	[]	1		
267	0	0	All the Average rainfall anomalies values are observed unique	train_man_267.csv	[]	0		
267	0	0	Impacts of rainfall anomalies are having three regions.	train_man_267.csv	[]	1		
267	0	0	Pseudo R 2 ranges from 0.05 -0.11.	train_man_267.csv	[]	1		
268	0	0	HIV knowledge is Respondent has heard of HIV .	train_man_268.csv	[]	1		
269	0	0	Education doesn't have any value in full and reduced sample.	train_man_269.csv	[]	1		
269	0	0	HIV knowledge std.dev value in full sample is 0.73.	train_man_269.csv	[]	0		
269	0	0	Mean value of education in full sample is 0.55.	train_man_269.csv	[]	0		
269	0	0	Reduced sample of all parameters have unique value in Std.Dev.	train_man_269.csv	[]	0		
269	0	0	The highest mean value in full sample is 0.12.	train_man_269.csv	[]	0		
269	0	0	There are 8 kinds of sample.	train_man_269.csv	[]	0		
269	0	0	There are two kinds of sample full and reduced sample.	train_man_269.csv	[]	1		
270	0	0	Compare to both the task the value of MEL under task 1 for AUC is least value 9.928.	train_man_270.csv	[]	0		
270	0	0	The table has been divided into three task - Task1 Task 2 and Task3.	train_man_270.csv	[]	0		
270	0	0	The value of BCC under task 2 for Spec is highest 0.958.	train_man_270.csv	[]	1		
270	0	0	The value of UNK is 0 under task 2 for Sens.	train_man_270.csv	[]	1		
270	0	0	The value of UNK is 8 under task 2 for Sens.	train_man_270.csv	[]	0		
270	0	0	There are nine class.	train_man_270.csv	[]	1		
271	0	0	In Ramp case there are 8 kinds .	train_man_271.csv	[]	0		
271	0	0	The Highest SF ramp time (min) is 1.	train_man_271.csv	[]	0		
271	0	0	The Highest SF ramp time (min) is 120.	train_man_271.csv	[]	1		
271	0	0	The Lowest GT ramp time (min) is 4.7.	train_man_271.csv	[]	0		
271	0	0	The Lowest GT ramp time (min) is 80.	train_man_271.csv	[]	0		
271	0	0	The three ramp cases, (fast, mid and slow, Table 2 ) are simulated with the dynamic process model.	train_man_271.csv	[]	1		
272	0	0	The chemical Poly(ethylene glycol) diacrylate (PEGDA) has highest	train_man_272.csv	[]	1		
273	0	0	PEG-BAC has lowest value in D M , EY (m 2 /s) of 2.5 o 10 -11.	train_man_273.csv	[]	1		
273	0	0	PEG-HA (+ LiClO 4 ) has highest D EY , f (m 2 /s) of 6.1 o 10 -10.	train_man_273.csv	[]	1		
274	0	0	In As- built the highest temperature is 2.7  10 7 in 800 C.	train_man_274.csv	[]	1		
274	0	0	In table the temperature has 2 different C i.e, 650 and 800.	train_man_274.csv	[]	1		
274	0	0	In table they have 8 kinds of Specimens.	train_man_274.csv	[]	0		
274	0	0	The k p values increased significantly when the specimens were exposed at 800 C compared to 650 C.	train_man_274.csv	[]	1		
275	0	0	2 hours is the heighest time consumed for saturation of Soil texture.	train_man_275.csv	[]	0		
275	0	0	6 hours is the heighest time consumed for saturation of soil texture.	train_man_275.csv	[]	1		
275	0	0	About 10 min is consumed for Sandy loam texture.	train_man_275.csv	[]	0		
275	0	0	About 45 min is consumed for Sandy loam texture.	train_man_275.csv	[]	1		
275	0	0	Coarse sands Consume least time for saturation of soil texture.	train_man_275.csv	[]	1		
275	0	0	Each texture type has different Time for saturation.	train_man_275.csv	[]	1		
275	0	0	The required time of saturating different kinds of soils may vary ( Table 1 ).	train_man_275.csv	[]	1		
275	0	0	There are 4 types of Soil Textures in the table.	train_man_275.csv	[]	0		
276	0	0	At  = 20 L has highest value 82 .	train_man_276.csv	[]	1		
276	0	0	The corner depth ( C ) has lowest value at  = 2 that is 2.	train_man_276.csv	[]	0		
276	0	0	The genetic algorithm optimisation is performed with four increasing envelope widths  (2, 10, 20 and 28 pixels) and using a = 0.5.	train_man_276.csv	[]	1		
276	0	0	There are five Output parameters.	train_man_276.csv	[]	1		
276	0	0	The highest value 83 is at = 10 L .	train_man_276.csv	[]	1		
276	0	0	The highest value 80 occurs at =2L.	train_man_276.csv	[]	1		
276	0	0	At  = 10 L has highest value 83 .	train_man_276.csv	[]	1		
277	0	0	The prediction value of 0 and 1 is different for Unsupervised and Supervised Reference.	train_man_277.csv	[]	1		
278	0	0	33.1990 Blue is Projected area (um2).	train_man_278.csv	[]	1		
278	0	0	33.1990 Red is Projected area (um2).	train_man_278.csv	[]	0		
278	0	0	Green 42.0068 is Dry mass (pg).	train_man_278.csv	[]	0		
278	0	0	Min Red is 1.4030.	train_man_278.csv	[]	1		
278	0	0	Red 197.5795 is Surface area (um2).	train_man_278.csv	[]	0		
279	0	0	Palm Oil has the heighest Kinematic Viscosity.	train_man_279.csv	[]	1		
279	0	0	Palm Oil has the lowest Kinematic Viscosity.	train_man_279.csv	[]	0		
279	0	0	Relative density of Palm Oil is 0.924.	train_man_279.csv	[]	1		
279	0	0	Relative density, Kinematic Viscosity and Flash point are the properties of oil's.	train_man_279.csv	[]	1		
279	0	0	The properties of the oil are given in Table 1 .	train_man_279.csv	[]	1		
279	0	0	There are 4 type of oil.	train_man_279.csv	[]	0		
280	0	0	95% Palm Oil for Oil Cutting fluid composition .	train_man_280.csv	[]	0		
280	0	0	Peanut Oil C3 is 95% for Water.	train_man_280.csv	[]	1		
280	0	0	The cutting fluid compositions are given in Table 2 .	train_man_280.csv	[]	1		
280	0	0	Total 0% is same for Servocut S, Palm Oil,Peanut Oil.	train_man_280.csv	[]	0		
280	0	0	Total 100% is same for Servocut S, Palm Oil,Peanut Oil.	train_man_280.csv	[]	1		
281	0	0	0.8 for level 3 and Notation is r.	train_man_281.csv	[]	0		
281	0	0	Control factors Cutting fluid (no unit) Notation is C and level 1 is C1 .	train_man_281.csv	[]	1		
281	0	0	Cutting fluid (no unit) Notation is n.	train_man_281.csv	[]	0		
281	0	0	Depth of Cut (mm) Notation is d and level 1 is 0.2.	train_man_281.csv	[]	0		
281	0	0	Spindle Speed (rpm) level 3 is 3400.	train_man_281.csv	[]	0		
282	0	0	All the values for source fc, dc, fd and rc is 0.00.	train_man_282.csv	[]	0		
282	0	0	All the values for source fc, dc, nc and rc is 0.00.	train_man_282.csv	[]	1		
282	0	0	The df value differs for each source in the table.	train_man_282.csv	[]	0		
282	0	0	The highest p - value is 1.000 for nc, fc, dc and rc.	train_man_282.csv	[]	1		
282	0	0	The least contribution value is 0.01% in c source.	train_man_282.csv	[]	0		
282	0	0	The P-value is determined by 95% of the confidence limit.	train_man_282.csv	[]	1		
282	0	0	There are 12 different types of sources in the given table.	train_man_282.csv	[]	1		
283	0	0	Only the surface configuration are unique.	train_man_283.csv	[]	0		
