id	annotator	position	question	table_file	answer_coordinates	answer_text	aggregation	float_answer
752	0	0	Constraints is the only table head given .	train_man_752.csv	[]	0		
753	0	0	Every group has different description.	train_man_753.csv	[]	1		
753	0	0	Every group has same description.	train_man_753.csv	[]	0		
753	0	0	Group Oithona similis has less unidentified percent.	train_man_753.csv	[]	1		
753	0	0	Group Ostracoda is unidentified beyond class.	train_man_753.csv	[]	1		
753	0	0	In addition to the 11 broad-scale taxonomic groupings, total zooplankton abundance across all taxa was also calculated.	train_man_753.csv	[]	1		
753	0	0	Larva is present in the group Ostracoda.	train_man_753.csv	[]	0		
753	0	0	There are eleven groups of zooplankton taxa.	train_man_753.csv	[]	1		
753	0	0	There are twelve groups of zooplankton taxa.	train_man_753.csv	[]	0		
754	0	0	All the variables has same unit.	train_man_754.csv	[]	0		
754	0	0	Each variable has its own unit.	train_man_754.csv	[]	1		
754	0	0	Reference for sst and vgpm is same.	train_man_754.csv	[]	0		
754	0	0	the description given for each variable is uniquely defined.	train_man_754.csv	[]	1		
754	0	0	The unit of SeaIce is m.	train_man_754.csv	[]	0		
754	0	0	There are 6 types of variables.	train_man_754.csv	[]	1		
755	0	0	Actual measurements of conditions for the sampling month is Description for climAnom Model name.	train_man_755.csv	[]	0		
755	0	0	The Description for clim Model name is Training: Monthly climatological oceanographic conditions. Extrapolation: Actual monthly means used instead of climatological months.	train_man_755.csv	[]	1		
755	0	0	There are five different types Model name.	train_man_755.csv	[]	1		
756	0	0	> 1.27, p < 0.0005, for N = 45,489).	train_man_756.csv	[]	1		
756	0	0	The highest sst value is 20.09 of Oithona similis.	train_man_756.csv	[]	1		
756	0	0	The highest value is 0.1 of Sealce in Euphausiidae cluster.	train_man_756.csv	[]	0		
756	0	0	The other variables in decreasing order of overall importance were mixed layer depth, time of day ( E coszen ), primary production ( vgpm ), phytoplankton biomass ( chl ), month , sstgrad (indicative of frontal activity), and sea-ice concentration ( seaIce ).	train_man_756.csv	[]	1		
757	0	0	Gender male has 98.1%.	train_man_757.csv	[]	0		
757	0	0	Higher education-not university Has 78.4 percentage value.	train_man_757.csv	[]	0		
757	0	0	Income more than average has 93.0 percentage value.	train_man_757.csv	[]	0		
757	0	0	Mean in years for Age is 22.5%	train_man_757.csv	[]	0		
758	0	0	All the values given in the table consists of positive values.	train_man_758.csv	[]	1		
758	0	0	The highest total is 15836 of Female in Primary Sjogren's syndrome.	train_man_758.csv	[]	1		
758	0	0	The lowest Event in Control Cohort is 25 of age 18-29.	train_man_758.csv	[]	1		
758	0	0	The subgroups are divided into 4 sub heads	train_man_758.csv	[]	0		
759	0	0	12.42 is the value given for Tidal period ( T ) [hour] .	train_man_759.csv	[]	1		
759	0	0	82.42 is the value given for Tidal period ( T ) [hour] .	train_man_759.csv	[]	0		
759	0	0	92.42 is the value given for Tidal period ( T ) [hour] .	train_man_759.csv	[]	0		
759	0	0	Compare to all the Restriction length ( RL ) [m] parameter has the highest value of 500.	train_man_759.csv	[]	1		
759	0	0	Manning coefficient n [s/m 1/3 ] parameter has the least value of 0.03 compare to all other values.	train_man_759.csv	[]	1		
759	0	0	Table 1 presents the parameters that were varied across the simulation cases.	train_man_759.csv	[]	1		
759	0	0	There are three heads in the table- Parameter, diameter and Value(s).	train_man_759.csv	[]	0		
759	0	0	There are two heads in the table- Parameter and Value(s).	train_man_759.csv	[]	1		
760	0	0	The bias value for RIS1 and RIS3 is same as 1.73.	train_man_760.csv	[]	0		
760	0	0	The highest Ea/Precip value is 0.16 of GK2.	train_man_760.csv	[]	0		
760	0	0	The highest KGE value is 0.69 of GK1.	train_man_760.csv	[]	0		
760	0	0	The highest KGE value is 0.92 of RIS3.	train_man_760.csv	[]	1		
760	0	0	There are 8 periods given in the table.	train_man_760.csv	[]	0		
761	0	0	RIS has the highest value in Gsh of 2.97.	train_man_761.csv	[]	1		
761	0	0	RIS has the highest value in Pmid [m] of 31.7.	train_man_761.csv	[]	0		
761	0	0	RIS has the lowest value in Gsh of 1.57.	train_man_761.csv	[]	0		
761	0	0	RIS has the lowest value in Pmid [m] of 31.0.	train_man_761.csv	[]	1		
761	0	0	Table 4 shows the calibrated values of Gsh and Gsc together with the corresponding estimates of mean subsurface velocity.	train_man_761.csv	[]	1		
761	0	0	There are five different Calibrated values.	train_man_761.csv	[]	0		
761	0	0	There are two different Calibrated values.	train_man_761.csv	[]	1		
762	0	0	0.37 is the Mean.	train_man_762.csv	[]	1		
762	0	0	0.997 is the Mean.	train_man_762.csv	[]	0		
762	0	0	NSE(DDDUrban) has the highest value of 0.80 compare to all other.	train_man_762.csv	[]	1		
762	0	0	RIS1(S) has value of 1.27 under NSE(DDDUrban)	train_man_762.csv	[]	0		
762	0	0	RIS4(S) has 0.41 value under NSE(H&A,2018).	train_man_762.csv	[]	1		
762	0	0	RIS4(S) has 8.41 value under NSE(H&A,2018).	train_man_762.csv	[]	0		
762	0	0	The time periods of validation are very short (12 days), excepting the fourth period which is 4 months in length.	train_man_762.csv	[]	1		
763	0	0	The highest KGE is 0.002.	train_man_763.csv	[]	0		
763	0	0	The highest M [mm] is 84.1.	train_man_763.csv	[]	1		
763	0	0	The lowest Mean distance P areas [m] is 13.5.	train_man_763.csv	[]	1		
764	0	0	NG-1 has no Type of flexural rod.	train_man_764.csv	[]	0		
764	0	0	Shear strengthening arranging are of three types.	train_man_764.csv	[]	1		
765	0	0	Flexure and Shear are two failure mode given in the table.	train_man_765.csv	[]	1		
765	0	0	On of which, shear failure was noticed in test beams without stirrups (NG-0, NG-0.5 and NG-1), as expected, these beams failed in shear mode with an idealistic shear crack at shear side.	train_man_765.csv	[]	1		
765	0	0	Specimen FG-1 has lowest total failure load.	train_man_765.csv	[]	0		
765	0	0	Specimen SR-0 and SG-0 has same Retrofitting arrangement.	train_man_765.csv	[]	1		
765	0	0	Specimen UG-0.5 does not have any failure mode.	train_man_765.csv	[]	0		
765	0	0	There are eleven specimen designation is given in the table.	train_man_765.csv	[]	1		
765	0	0	There are five specimen designation is given in the table.	train_man_765.csv	[]	0		
766	0	0	Experimental shear load ranges from 31.5 to 76.5.	train_man_766.csv	[]	1		
766	0	0	There are 11 Specific designation.	train_man_766.csv	[]	1		
766	0	0	There are 15 Specific designation.	train_man_766.csv	[]	0		
767	0	0	Clinical characteristics of the study population are summarized in Table 1 .	train_man_767.csv	[]	1		
767	0	0	The Females (%) under all three stages is 100%.	train_man_767.csv	[]	1		
767	0	0	The Females (%) under all three stages is 500%.	train_man_767.csv	[]	0		
767	0	0	24.3 (22.026.0) is the highest BMI (kg/m 2 ) (median [IQR]) value under CTRL.	train_man_767.csv	[]	1		
767	0	0	AN has 26 (23.0%) as the value for current Characteristics.	train_man_767.csv	[]	1		
768	0	0	As shown in Table 1 , the joint angles of the upper arm, upper arm and lower arm, trunk and leg, and trunk are used to identify the subclass type of the picking activities.	train_man_768.csv	[]	1		
768	0	0	Picking from high location ( P high ) Joint angles is Upper arm.	train_man_768.csv	[]	1		
768	0	0	Picking from low location ( P low ) Range is x>60 x>110.	train_man_768.csv	[]	1		
768	0	0	Range x>60 x>110 is Picking from low location ( P low ).	train_man_768.csv	[]	1		
769	0	0	Picking items from medium-height location ( P med ) has same MF value in OP environment A and C.	train_man_769.csv	[]	1		
769	0	0	Unloading items from cart to packing area ( P unload ) has more time in OP environment C.	train_man_769.csv	[]	1		
769	0	0	We compare the three OP environments by taking the average for all participants.	train_man_769.csv	[]	1		
770	0	0	Non-Opioid Rx (n = 116) Prescriptions Mean (S.D) range is 3.471.	train_man_770.csv	[]	0		
770	0	0	Non-Opioid Rx (n = 116) Providers Mean (S.D) range is 3.2 (2.7).	train_man_770.csv	[]	0		
770	0	0	Opioid Rx (n = 412) Providers Mean (S.D) range is 3.2 (2.7) and 119.	train_man_770.csv	[]	1		
770	0	0	Range 18) providers and 2.1	train_man_770.csv	[]	1		
771	0	0	Every Redox couple has different D ox /10 10 m 2 /s value.	train_man_771.csv	[]	1		
771	0	0	Hexachloroiridate with medium 0.5 M KNO 3 does not have D ox value.	train_man_771.csv	[]	0		
771	0	0	Hexachloroiridate with medium 0.5 M KNO 3 does not have D red value.	train_man_771.csv	[]	1		
771	0	0	Hexacyanoferrate and Hexachloroiridate has same medium.	train_man_771.csv	[]	0		
772	0	0	Hexachloroiridate and Hexacyanoferrate are two redox couple given in the given.	train_man_772.csv	[]	1		
772	0	0	Hexacyanoferrate has lowest percent of Stability during reduction (RDE).	train_man_772.csv	[]	1		
772	0	0	In Table 3 the main differences between both redox couples are summarized.	train_man_772.csv	[]	1		
772	0	0	Stability during reduction (RDE) does not have PH value.	train_man_772.csv	[]	1		
773	0	0	0.70925 is the 87 Sr/ 86 Sr value for Position 2, 50m.	train_man_773.csv	[]	1		
773	0	0	0.70929 is the 87 Sr/ 86 Sr value for Position 3,10 0m.	train_man_773.csv	[]	1		
773	0	0	0.70931 is the 87 Sr/ 86 Sr value for Position 4, 150m.	train_man_773.csv	[]	1		
773	0	0	0.71003 is the 87 Sr/ 86 Sr value for Position 1, 0m.	train_man_773.csv	[]	1		
773	0	0	0.87456 is the 87 Sr/ 86 Sr value for Position 3,10 0m.	train_man_773.csv	[]	0		
773	0	0	The concentration for the control sample is [Sr] =	train_man_773.csv	[]	1		
773	0	0	Transect 1 has five potion with unique for each position.	train_man_773.csv	[]	1		
774	0	0	Sea water has low mg of chlorine composition.	train_man_774.csv	[]	0		
774	0	0	There are five water groups and of seawater given in the table.	train_man_774.csv	[]	1		
774	0	0	Water group C1 and C2 has same average pH value.	train_man_774.csv	[]	1		
774	0	0	Water group C3 different mg of DO and HCO 3 .	train_man_774.csv	[]	0		
775	0	0	Chichi-jima has 1.102 for Lower level for 45-y (m).	train_man_775.csv	[]	0		
775	0	0	Upper level for 35-y (m) for Naha is 0.118	train_man_775.csv	[]	1		
775	0	0	z -value of Naha is 3380.	train_man_775.csv	[]	0		
775	0	0	z -value of Naha is 6.13.	train_man_775.csv	[]	1		
776	0	0	Bulk tailings of C org have the value of 0.16.	train_man_776.csv	[]	1		
776	0	0	Bulk tailings of Cu have the value of 17.7.	train_man_776.csv	[]	0		
776	0	0	Bulk tailings of Pb have the value of 0.24.	train_man_776.csv	[]	0		
776	0	0	Microbial communities grown on tailings concentrate produced a heat output of 109 W/g ( Fig. 4 b), which was 2.7 times higher than for bulk tailings, but lower than values obtained for copper concentrate bioleaching at higher temperature	train_man_776.csv	[]	1		
776	0	0	tailings concentr of C org have the value of 1.44.	train_man_776.csv	[]	1		
776	0	0	The higher sulfide content related to pyrite in the tailings concentrate than in the bulk tailings ( Table 1 )	train_man_776.csv	[]	1		
776	0	0	There are two different Elemental composition.	train_man_776.csv	[]	1		
776	0	0	Bulk tailings of Fe have the value of 10.2.	train_man_776.csv	[]	1		
777	0	0	Job performance has the highest value for M of 3.84.	train_man_777.csv	[]	1		
777	0	0	Job performance has the highest valueof 0.11 for SD.	train_man_777.csv	[]	0		
777	0	0	Job performance has the lowest value for SD of 0.44.	train_man_777.csv	[]	1		
777	0	0	Job performance has the lowest value of 3.77 for M.	train_man_777.csv	[]	0		
777	0	0	Playful work design has the highest value for M of 0.12.	train_man_777.csv	[]	0		
777	0	0	There are six different Means, standard deviations, and inter-correlations between the study variables.	train_man_777.csv	[]	1		
777	0	0	Work pressure has the highest value for SD of 0.91.	train_man_777.csv	[]	1		
777	0	0	Work pressure has the lowest value for SD of 5.71.	train_man_777.csv	[]	0		
778	0	0	In support of the predicted interaction effect, we find that the playful work design  work pressure interaction is negative and significant (B = 0.045, p < .009) in the interaction model ( Table 2 ).	train_man_778.csv	[]	1		
778	0	0	Interaction model p < is having same values for all performances.	train_man_778.csv	[]	0		
778	0	0	Intercept of B is 3.841.	train_man_778.csv	[]	1		
778	0	0	Multilevel estimates for models with job performance as dependent variable (day level). is observed.	train_man_778.csv	[]	1		
778	0	0	Null model of Work pressure is empty.	train_man_778.csv	[]	1		
778	0	0	The job performance of Increasing challenges is same for all.	train_man_778.csv	[]	0		
778	0	0	Variance and SE level 1 for Null model B is 0.135 (71.0%) .	train_man_778.csv	[]	1		
779	0	0	2 Log likelihood B is 1584.941.	train_man_779.csv	[]	1		
779	0	0	As shown in Table 3 reported in Appendix A , the sensitivity analysis revealed almost identical parameter estimates and levels of significance for all interactions tested in our focal analysis (B = 0.023, p < .159; B = 0.048, p < .006;	train_man_779.csv	[]	1		
779	0	0	B = 0.030, p < .067	train_man_779.csv	[]	1		
779	0	0	The Intercept of the Interaction model B is 0.045 .	train_man_779.csv	[]	0		
779	0	0	The Intercept of the Interaction model B is 3.856.	train_man_779.csv	[]	1		
779	0	0	The Intercept of the Interaction model SE is 3.856.	train_man_779.csv	[]	0		
779	0	0	The SE of Interaction model  for Variance and SE level 1 is 0.003.	train_man_779.csv	[]	1		
780	0	0	Caenorhabditis elegans homologue of Tsp miR_68 is miR-51.	train_man_780.csv	[]	0		
780	0	0	Caenorhabditis elegans homologue of Tsp miR_68 is miR-80.	train_man_780.csv	[]	1		
780	0	0	Enrichment secreted material (adult) have the highest value for Tsp miR-65 of 34.7.	train_man_780.csv	[]	1		
780	0	0	Enrichment secreted material (MSL) have the highest value for Tsp miR_68 of 16.4.	train_man_780.csv	[]	1		
780	0	0	Mammalian homologue of Tsp miR_68 is let7.	train_man_780.csv	[]	0		
780	0	0	miR-80 is the Caenorhabditis elegans homologue of Tsp miR_15	train_man_780.csv	[]	0		
780	0	0	miR-80 is the Caenorhabditis elegans homologue of Tsp miR_68	train_man_780.csv	[]	1		
780	0	0	There are five different categories of Sequences.	train_man_780.csv	[]	0		
781	0	0	All retailers and R&W shared storage space, and some smaller wholesalers as well.	train_man_781.csv	[]	1		
781	0	0	The highest education number is 9.46(3.78).	train_man_781.csv	[]	1		
781	0	0	The highest Retail & Wholesale is 1.56(0.73).	train_man_781.csv	[]	0		
781	0	0	The highest Retail is 51.	train_man_781.csv	[]	1		
781	0	0	The lowest Retail is 51.	train_man_781.csv	[]	0		
781	0	0	There are 4 different types of variables in the given table.	train_man_781.csv	[]	0		
781	0	0	There are 9 different types of variables in the given table.	train_man_781.csv	[]	1		
781	0	0	There is no value for Capacity of store (tons).	train_man_781.csv	[]	0		
782	0	0	Material Properties of PEEK is classified into 2 Classifications.	train_man_782.csv	[]	1		
782	0	0	PEEK has the Elastic modulus of 0.6 GPa.	train_man_782.csv	[]	0		
782	0	0	PEEK has the Elastic modulus of 3.6 GPa.	train_man_782.csv	[]	1		
782	0	0	The process parameters are as follows: the step depth of 0.4 mm, tool diameter of 10 mm, tool rotation speed of 100 r/min and Grease MP-3 continuous lubrication.	train_man_782.csv	[]	1		
782	0	0	616 k is the melting point of the PEEK.	train_man_782.csv	[]	1		
783	0	0	Elastic modulus (GPa) ranges from 2.9-3.4.	train_man_783.csv	[]	1		
783	0	0	Melting temperature(K) is 0.	train_man_783.csv	[]	0		
783	0	0	There are four Mechanical properties .	train_man_783.csv	[]	1		
783	0	0	There are four Thermal properties .	train_man_783.csv	[]	1		
783	0	0	Thermal conductivity (W/mk) is 0.16.	train_man_783.csv	[]	1		
784	0	0	Value of  is  1 , . . . ,  m.	train_man_784.csv	[]	1		
784	0	0	Vector whose i th td is 1 and other entries are zero.	train_man_784.csv	[]	1		
785	0	0	C 10 FAME Abundance (%) is 44.90.	train_man_785.csv	[]	1		
785	0	0	Component of Rhamnolipid Rha-C 14:2 FAME is C C 10:2 .	train_man_785.csv	[]	0		
785	0	0	FAME C 14:2 Component of Rhamnolipid is Rha-C 8:2.	train_man_785.csv	[]	0		
785	0	0	FAME C 8:2 Component of Rhamnolipid is Rha-C 8:2.	train_man_785.csv	[]	1		
785	0	0	Molecular formula C 11 H 20 O 3 FAME is C 10:1.	train_man_785.csv	[]	1		
786	0	0	There are different Correlation of urbanisation indices calculated from areas with radii of 50, 100, 200, 500, and 1000 m.	train_man_786.csv	[]	1		
786	0	0	Urbanisation index of % Macrophyte has the highest value of 0.490 for 50 m.	train_man_786.csv	[]	1		
786	0	0	Urbanisation index of % Macrophyte has the least value of 0.479 for 500 m.	train_man_786.csv	[]	0		
786	0	0	Urbanisation index of % Sand has the highest value of 0.179 for 200 m.	train_man_786.csv	[]	0		
786	0	0	Urbanisation index of % Sand has the highest value of 0.179 for 500 m.	train_man_786.csv	[]	0		
786	0	0	Urbanisation index of % Sand has the least value of 0.079 for 100 m.	train_man_786.csv	[]	1		
786	0	0	Urbanisation index of % Sand has the least value of 0.079 for 50 m.	train_man_786.csv	[]	1		
786	0	0	Urbanisation index of Light intensity has the highest value of 0.535 for 100 m.	train_man_786.csv	[]	1		
786	0	0	Urbanisation index of Light intensity has the least value of 1.535 for 300 m.	train_man_786.csv	[]	0		
787	0	0	0.010 is the least value as compared to all values for Stream (Intercept)	train_man_787.csv	[]	1		
787	0	0	783.32 is the value for AIC C under A Abundance Null model.	train_man_787.csv	[]	1		
787	0	0	b [95 % CI] is the common value given for Fixed effects.	train_man_787.csv	[]	1		
787	0	0	compare to all R 2 (c) value 8.993 is the highest under A Abundance Full mode column.	train_man_787.csv	[]	0		
787	0	0	Random effects has same value as BC for all categories.	train_man_787.csv	[]	0		
788	0	0	The highest Gaussian mixed model Null model is 43.36.	train_man_788.csv	[]	1		
788	0	0	The highest mean is 25.	train_man_788.csv	[]	0		
788	0	0	The lowest Full model is 0.012.	train_man_788.csv	[]	1		
789	0	0	annealed plate of 26 mm thickness.	train_man_789.csv	[]	1		
789	0	0	Balance 0.5 Mn is Ni.	train_man_789.csv	[]	1		
789	0	0	Balance 0.6 Mn is Ni.	train_man_789.csv	[]	0		
789	0	0	Nb + Ta Ni Balance is 3.5.	train_man_789.csv	[]	0		
789	0	0	Ni Co Balance is 1.	train_man_789.csv	[]	1		
789	0	0	Alloy 625 is a solid solution strengthened nickel alloy with the nominal composition given in Table 1 .	train_man_789.csv	[]	1		
789	0	0	Si is 0.5.	train_man_789.csv	[]	0		
790	0	0	A few co-formulated biologic-based products that have been recently approved or are under clinical development suggests an increasing interest in industry to combine biologic therapeutic agents into a single dosage form ( Table 2 ).	train_man_790.csv	[]	1		
790	0	0	Risk New regulation landscape needs to be introduced (potential delay in BLA approval)Characteristics is New market/product differential strategy.	train_man_790.csv	[]	1		
791	0	0	There are 6 different types of scale in the given table.	train_man_791.csv	[]	1		
792	0	0	All the observed values are unique.	train_man_792.csv	[]	0		
792	0	0	Splitting is the majority Failure type.	train_man_792.csv	[]	0		
792	0	0	Table 1 shows the results of the investigation on the failure mode in mortar during the screw pull-out operation.	train_man_792.csv	[]	1		
792	0	0	The Depth (mm) is 60 for all sample numbers.	train_man_792.csv	[]	1		
792	0	0	There are seven Sample number in the table.	train_man_792.csv	[]	1		
793	0	0	Curing is done with water only for Mix 1 mixtures.	train_man_793.csv	[]	0		
793	0	0	Water cement and sand cement ratio is different of Mix 1.	train_man_793.csv	[]	1		
794	0	0	The highest value for FC (n = 155) is 109 (74.7).	train_man_794.csv	[]	1		
794	0	0	The highest value for General population (n = 9489) is 8900 (94.9).	train_man_794.csv	[]	1		
794	0	0	The highest value for HIS (n = 141) is 116 (85.3).	train_man_794.csv	[]	1		
794	0	0	The highest value for p-value is 0.197.	train_man_794.csv	[]	1		
795	0	0	- Unadjusted, OR (95% CI) Received CWS-interventions IHS (n = 141) is 3.49 (2.40, 5.08).	train_man_795.csv	[]	1		
795	0	0	0.004 p-value Received CWS-interventions is - Fully adjusted, adj mean diff (95% CI).	train_man_795.csv	[]	1		
795	0	0	2.14 (1.42, 3.22) FC (n = 155) Received CWS-interventions is - Unadjusted, OR (95% CI).	train_man_795.csv	[]	1		
795	0	0	Received CWS-interventions p-value <0.001 is - Partially adjusted, adj mean diff (95% CI).	train_man_795.csv	[]	1		
796	0	0	p-value has a constant in the given table.	train_man_796.csv	[]	1		
796	0	0	The highest FC(n = 155) is 1.92 (1.35, 2.73).	train_man_796.csv	[]	1		
796	0	0	The highest p-value is 0.027.	train_man_796.csv	[]	1		
796	0	0	The lowest IHS(n = 141) is 2.31 (1.72, 3.38).	train_man_796.csv	[]	1		
796	0	0	The lowest p-value is 0.027.	train_man_796.csv	[]	0		
796	0	0	There are 6 types of analysis in the given table.	train_man_796.csv	[]	1		
796	0	0	We found a strong association between IHS-status and the total degree of SRP in both the unadjusted model (OR = 3.23, p < 0.001) and in the fully adjusted model (AOR = 2.31, p < 0.001)	train_man_796.csv	[]	1		
797	0	0	All the values in the given table is <0.	train_man_797.csv	[]	0		
797	0	0	The crop produce in supermarket and the animal produce in cooperative is 1.	train_man_797.csv	[]	0		
797	0	0	The lowest Crop produce is 69 in Final consumer.	train_man_797.csv	[]	0		
797	0	0	The total of Cooperative and Supermarket is same as 2.	train_man_797.csv	[]	1		
797	0	0	The total of Cooperative and Supermarket is same as 4.	train_man_797.csv	[]	0		
797	0	0	There are 7 types of Buyer in the given table.	train_man_797.csv	[]	1		
797	0	0	There are 9 types of Buyer in the given table.	train_man_797.csv	[]	0		
798	0	0	In relation to this point, types B, C, and D, which had higher engagement rates in FSPE ( Table 3 ), tended to use fewer chemical inputs than type A ( Table 1 ).	train_man_798.csv	[]	1		
798	0	0	Number of households that exchanged own vegetables, fruit, and/or herbs of Type D is 11(30.6).	train_man_798.csv	[]	1		
798	0	0	The Highest value in TypeB is 133 (83.1).	train_man_798.csv	[]	0		
798	0	0	The Lowest value in TypeC is 12 (7.5).	train_man_798.csv	[]	0		
798	0	0	The Lowest value in TypeD is 42 (26.3).	train_man_798.csv	[]	0		
798	0	0	They have different kinds of variables given.	train_man_798.csv	[]	1		
799	0	0	Household size Difference (6)=(5)-(4) is 0.1193***.	train_man_799.csv	[]	0		
799	0	0	Male household head Difference (7)=(5)-(3) is 0.0005.	train_man_799.csv	[]	0		
799	0	0	We thus run the same regressions for spring ordinary rice and autumn ordinary rice separately as a robustness check.	train_man_799.csv	[]	1		
800	0	0	Mean 0.297 for the year 2010 is Largest 20%.	train_man_800.csv	[]	0		
800	0	0	Smallest 20% Median for the year 2004 is 0.516.	train_man_800.csv	[]	0		
800	0	0	The top panel of Table 6 summarizes the HHI of agricultural output over the 20022016 period.	train_man_800.csv	[]	1		
800	0	0	Total farms for the year 2002 Median is 0.426.	train_man_800.csv	[]	0		
801	0	0	CFI and NFI value is accurate for the modelThree-factor baseline model.	train_man_801.csv	[]	1		
801	0	0	CFI and NFI value is same for the modelThree-factor baseline model.	train_man_801.csv	[]	0		
801	0	0	Model Unifactorial solution has highest X 2 value.	train_man_801.csv	[]	1		
801	0	0	The new simplified model fitted the data reasonably well, presenting the key indices reported in Table 2 .	train_man_801.csv	[]	1		
801	0	0	The p value is constant for every model.	train_man_801.csv	[]	1		
802	0	0	The Table contain 8 Factors.	train_man_802.csv	[]	0		
802	0	0	There is no Errors for F2, C, CV, CV, F1.	train_man_802.csv	[]	0		
802	0	0	There is no Errors for F3, CV, CV, CV.	train_man_802.csv	[]	1		
803	0	0	Only errors among Walking crashes path does not have its significant p value.	train_man_803.csv	[]	1		
803	0	0	Walking crashes does not have its significant p value.	train_man_803.csv	[]	0		
804	0	0	France had previously reported 7/9 Aspergillus species in culture under study of Alanio, 2020.	train_man_804.csv	[]	1		
804	0	0	Nasir, 2020 study had reported Pakistan 5/23 for CAPA	train_man_804.csv	[]	1		
804	0	0	van Arkel, 2020 study had reported France 5/23 for CAPA	train_man_804.csv	[]	0		
805	0	0	The highest water to raw materials value is 38 for M-10SBA, M-15SBA and M-15WSA.	train_man_805.csv	[]	0		
805	0	0	The highest water to raw materials value is 40 for M-10SBA, M-15SBA and M-15WSA.	train_man_805.csv	[]	1		
805	0	0	The lowest sludge value is 35 for M-15RSA, M-15SBA and M-15WSA.	train_man_805.csv	[]	1		
805	0	0	The nine mixtures were divided into three groups, namely, RSA, SBA and WSA.	train_man_805.csv	[]	1		
806	0	0	Oak of Oversegmentation in 2:1 is having 7 and highest .	train_man_806.csv	[]	1		
806	0	0	The Correct value of all is 724.	train_man_806.csv	[]	1		
806	0	0	Undersegmentation of 1:2 is having the total of 298.	train_man_806.csv	[]	1		
807	0	0	The highest male % in Detection accuracy using 14 randomly drawn tokens is 0.71(0.33) for Upper lip.	train_man_807.csv	[]	1		
807	0	0	The number of randomly drawn tokens in Detection is higher than the number of randomly drawn tokens in tracking.	train_man_807.csv	[]	1		
807	0	0	There are 4 scenarios in the given table.	train_man_807.csv	[]	1		
808	0	0	Each feature is undertaken in all three categories those are distance, time and kinematic.	train_man_808.csv	[]	1		
808	0	0	Lip opening and closing distance is observed in Index 9 and 10.	train_man_808.csv	[]	1		
808	0	0	Lips does not taken in Time category.	train_man_808.csv	[]	0		
808	0	0	The index value is constant for every set of features.	train_man_808.csv	[]	0		
